<!ELEMENT events (event+)>
<!ELEMENT event (title, date, description)>
<!ELEMENT title (#PCDATA)>
<!ELEMENT date (#PCDATA)>
<!ELEMENT description (#PCDATA)>
